title,pub_date,snippet,source,link
EIB invests €191 million in development of regional and municipal infrastructure projects in the Czech Republic,2021-07-13,"13 July 2021 - The European Investment Bank (EIB), the bank of the European Union, will provide €191 million to the Czech-Moravian Guarantee and Development Bank (ČMZRB), the Czech Republic`s promotional bank, to support financing of municipal and regional infrastructure development projects across the Czech Republic.",eib,https://www.eib.org/en/press/all/2021-262-eib-invests-eur191-million-in-development-of-regional-and-municipal-infrastructure-projects-in-the-czech-republic
Bulgaria: EIB provides €40 million for the modernisation of Sofia International Airport,2021-07-13,"13 July 2021 - The European Investment Bank (EIB) and SOF Connect AD, a special purpose vehicle that is majority-owned by Meridiam, have signed a €40 million loan agreement for the modernisation of Sofia International Airport. The financing is supported by the European Commission’s Connecting Europe Facility (CEF).",eib,https://www.eib.org/en/press/all/2021-261-eib-provides-eur40-million-for-the-modernisation-of-sofia-international-airport
Spain: EIB and BBVA provide €1.015 billion to support Spanish companies,2021-07-13,"13 July 2021 - The European Investment Bank (EIB) and BBVA have further strengthened their relationship and signed an agreement to support large Spanish companies and mid-caps affected by the economic crisis caused by the pandemic. To this end, the EIB will grant a guarantee of up to €400 million to BBVA, enabling the Spanish bank to mobilise more than €1.015 billion in the real economy via loans.",eib,https://www.eib.org/en/press/all/2021-260-eib-and-bbva-provide-eur1-015-billion-to-support-spanish-companies
The EIB welcomes the adoption of the Regulation for a Public Sector Loan Facility under the Just Transition Mechanism,2021-07-13,"13 July 2021 - The European Investment Bank (EIB) welcomes the adoption by the Council of the Regulation on the Public Sector Loan Facility on 12 July, which completes the Just Transition Mechanism. The latter is a key part of the European Green Deal, ensuring that no one will be left behind in the EU effort to achieve climate neutrality by 2050.",eib,https://www.eib.org/en/press/news/the-eib-welcomes-the-adoption-of-the-regulation-for-a-public-sector-loan-facility-under-the-just-transition-mechanism
"EIB joins The Valuable 500, the world’s biggest community for disability business inclusion",2021-07-12,"12 July 2021 - The President of the European Investment Bank (EIB), Werner Hoyer, signed The Valuable 500 Commitment, making the EIB the first Multilateral Development Bank member of the world’s biggest community for disability business inclusion.",eib,https://www.eib.org/en/press/all/2021-257-eib-joins-the-valuable-500-the-world-s-biggest-community-for-disability-business-inclusion
Zambia: EIB & KfW welcome progress in Lusaka sanitation project to double network access underway after decade of preparations,2021-07-12,"12 July 2021 - New investment to transform public health in the Zambian capital Lusaka by improving access by 525,000 families to sanitation, expanding wastewater treatment at two new plants in Chunga and Ngwerere, and construction of 520 km of sewerage pipes will be accelerated by disbursement of financing for the Lusaka Sanitation Program by the European Investment Bank and a grant by the German Development Bank, KfW, on behalf of the Federal Republic of Germany. .",eib,https://www.eib.org/en/press/all/2021-256-eib-kfw-welcome-progress-in-lusaka-sanitation-project-to-double-network-access-underway-after-decade-of-preparations
"Belgium: SRIW, EIB and Sofiprotéol support COSUCRA’s growth in the natural ingredients market",2021-07-09,"9 July 2021 - The Société Régionale d’Investissement de Wallonie (SRIW), the European Investment Bank (EIB) and Sofiprotéol, an Avril Group financing company, are jointly investing €10 million in a COSUCRA bond issue. COSUCRA will use this financing to strengthen its production capacity, helping to cement a leading position in its European markets.",eib,https://www.eib.org/en/press/all/2021-255-la-sriw-la-bei-et-sofiproteol-accompagnent-la-croissance-de-cosucra-sur-le-marche-des-ingredients-naturels
Senegal: Republic of Senegal and Team Europe support agree to build a manufacturing plant to produce vaccines against COVID-19 and other endemic diseases,2021-07-09,"9 July 2021 - Producing COVID-19 vaccines in Africa came one step closer today after Team Europe formally agreed to support large-scale investment in vaccine production by the Institut Pasteur in Dakar, alongside other support measures. The new manufacturing plant should reduce Africa’s 99% dependence on vaccine imports and strengthen future pandemic resilience on the continent.",eib,https://www.eib.org/en/press/all/2021-254-president-of-senegal-macky-sall-welcomes-team-europe-support-to-help-build-a-manufacturing-plant-in-senegal-to-produce-vaccines-against-covid-19-and-other-endemic-diseases
FINS: European Investment Fund backs €5.5 million loans for undergraduate and postgraduate students across the EU,,"The European Investment Fund and FINS will strengthen support for student loans following agreement of a new EFSI Skills & Education Pilot guarantee in Romania. This will allow school and college students within the EU, who want to pursue Bachelor’s and Master’s degrees in any EU Member State, to get a student loan without the need for income history, real estate guarantees or co-signers.",eif,../../what_we_do/guarantees/news/2021/fins-eif-backs-eur5.5million-loans-for-students-across-the-eu.htm
European Guarantee Fund: DKK 425m for Danish SMEs with Flex Funding,,"Danish SME-lending platform Flex Funding has signed a guarantee agreement with the European Investment Fund (EIF) for a total guaranteed portfolio of up to DKK 425 million. The new agreement, the first one with a crowd-lending platform under the “European Guarantee Fund”, ensures that hundreds of Danish SMEs will be able to benefit from new lending on more favourable terms. Flex Funding will provide new, more favourable, debt financing to these Danish SMEs ensuring that they have ...",eif,../../what_we_do/guarantees/news/2021/egf-dkk-425m-for-danish-smes-with-flex-funding.htm
OTB Ventures launches new $60m fund to back European businesses at the next stage of growth,,"EIF supported OTB Ventures, a leading venture capital firm investing in early-stage technology businesses with R&D in Central and Eastern Europe (CEE) and global potential, today launches the new OTB Growth Fund I. The fund, totalling $60m (EUR 50m), provides OTB Ventures with the capabilities to support its successful portfolio companies with additional follow-on investments as they scale-up to pursue and accelerate international growth opportunities.",eif,../../what_we_do/equity/news/2021/otb-ventures-launches-new-60m-fund-to-back-european-businesses-at-the-next-stage-of-growth.htm
European Guarantee Fund well over half its €24.4 bn target in first 6 months,,"The European Guarantee Fund, which started operations in December 2020, has reached €16 billion in approved financing at the end of June. This represents over 65% of the available € 24.4 billion in EU Member States’ guarantees to support financing to European businesses struggling after the economic downturn. Total signatures with beneficiaries of financing under the EGF stood at €8.4 billion, mostly benefitting SMEs.",eif,../../what_we_do/guarantees/news/2021/egf-well-over-half-its-24-4-bn-target-in-first-6-months.htm
Qredits gets European boost for post-COVID support: €70m for Dutch companies,,"Dutch microcredit provider Qredits has signed a guarantee agreement with the European Investment Fund (EIF) in the framework of the pan-European Guarantee Fund (EGF), set up by EU Member States and the EIB Group to help European companies with the necessary funding to find their way out of the crisis caused by the COVID-pandemic.",eif,../../what_we_do/guarantees/news/2021/qredits-gets-european-boost-for-post-covid-support-for-dutch-companies.htm
EIT Urban Mobility is taking the MUVment challenge!,2021-07-14,,eit,https://eit.europa.eu/news-events/news/eit-urban-mobility-taking-muvment-challenge
New EIT Digital Board Alumni Foundation appointed,2021-07-13,,eit,https://eit.europa.eu/news-events/news/new-eit-digital-board-alumni-foundation-appointed
"EIT Climate-KIC and Irish Aid partnership supporting start-ups across Africa, Asia and South America",2021-08-07,,eit,https://eit.europa.eu/news-events/news/eit-climate-kic-and-irish-aid-partnership-supporting-start-ups-across-africa-asia
EIT InnoEnergy powering the sustainable energy future in France,2021-07-07,,eit,https://eit.europa.eu/news-events/news/eit-innoenergy-powering-sustainable-energy-future-france
"EIT Manufacturing launched new social innovation platform, AGORA",2021-07-07,,eit,https://eit.europa.eu/news-events/news/eit-manufacturing-launched-new-social-innovation-platform-agora
Evaluation criteria for the EIT’s upcoming call for proposals published,2021-06-07,,eit,https://eit.europa.eu/news-events/news/evaluation-criteria-eits-upcoming-call-proposals-published
"Project developing slower energy release, points the way to healthier foods",2021-06-07,,eit,https://eit.europa.eu/news-events/news/project-developing-slower-energy-release-points-way-healthier-foods
Leading European universities to host the Raw Materials University Days 2021,2021-06-07,,eit,https://eit.europa.eu/news-events/news/leading-european-universities-host-raw-materials-university-days-2021
Five start-ups selected for the EIT Health Gold Track mentorship programme,2021-06-29,,eit,https://eit.europa.eu/news-events/news/five-start-ups-selected-eit-health-gold-track-mentorship-programme
"ADVITOS, a company supported by EIT Digital Accelerator, completes €20m financing round",2021-06-24,,eit,https://eit.europa.eu/news-events/news/advitos-company-supported-eit-digital-accelerator-completes-eu20m-financing-round
EIT Urban Mobility Accelerator Pitch Awards 2021 Winners,2021-06-24,,eit,https://eit.europa.eu/news-events/news/eit-urban-mobility-accelerator-pitch-awards-2021-winners
Northvolt’s USD 2.75 billion capital raise is a milestone in achieving the European Green Deal,2021-06-18,,eit,https://eit.europa.eu/news-events/news/northvolts-usd-275-billion-capital-raise-milestone-achieving-european-green-deal
Med Pearls project is looking for a web development company,2021-07-14 12:00:00,"The Palestine Information and Communication Technology Incubator is seeking to hire a service provider for the creation of the Med Pearls Online Platfform. Deadline: August 22nd, 4PM EEST.",enicbcmed,"[[...], [...], [...], [...], [...], [...], [...], [...], [...]]"
JOB ANNOUNCEMENT: the American University of Beirut is looking for a MED-InA project manager !,2021-07-13 12:00:00,"The American University of Beirut  is looking for a project manager ! Please note that only Lebanese nationals may apply.
More information:…",enicbcmed,"[[...], [...], [...], [...], [...], [...], [...], [...], [...]]"
Skills4Sports: the Development Agency of Evia is hiring an external auditor,2021-07-13 12:00:00,"The deadline for the submission of offers is up to July 20th, 2021 at 14.00 Greek time (EET).",enicbcmed,"[[...], [...], [...], [...], [...], [...], [...], [...], [...]]"
DECOST: open tender in Palestine to implement a market analysis study,2021-07-13 12:00:00,Consultancy services are required to implement a market analysis study related with municipal organic waste management systems. Deadline: 12/08/2021,enicbcmed,"[[...], [...], [...], [...], [...], [...], [...], [...], [...]]"
Save the date: learn about capitalizing EU projects´ results on Mediterranean sustainable growth,2021-07-13 12:00:00,"On 15th July 2021, INTERREG MED and ENI CBC MED programmes in Italy organise a webinar to share experiences to better capitalize their proje…",enicbcmed,"[[...], [...], [...], [...], [...], [...], [...], [...], [...]]"
AQUACYCLE: Do not miss out on your copy of our fourth e-Newsletter!,2021-07-13 12:00:00,In this edition we celebrate the launch of the AQUACYCLE e-Training Platform and invite you to join us in September for the CEST2021 Conference!,enicbcmed,"[[...], [...], [...], [...], [...], [...], [...], [...], [...]]"
InnovAgroWoMed-Spain: JOVESOLIDES is hiring teaching staff,2021-07-12 12:00:00,"JOVESOLIDES will be receiving proposals till one week before each unit training to start (check the attached ""TORs"" document).",enicbcmed,"[[...], [...], [...], [...], [...], [...], [...], [...], [...]]"
"ITALY: CRE@CTIVE partner, Consorzio Arca, is looking to hire an External Auditor",2021-07-12 12:00:00,"Consorzio Arca, is requesting the services of an external auditor for the verification of its revenues and expenditures connected to CRE@CTIVE project. Deadline: 16/07/2021",enicbcmed,"[[...], [...], [...], [...], [...], [...], [...], [...], [...]]"
BESTMEDGRAPE project: job vacancy for communication in Lebanon,2021-07-12 12:00:00,"The Lebanese partner, Saint Joseph University, is hiring staff for communication and capitalization of the project´s results",enicbcmed,"[[...], [...], [...], [...], [...], [...], [...], [...], [...]]"
Geography of new employment dynamics in Slovakia,2021-07-06,We published a new report on the geography of new employment dynamics in Slovakia. The report focuses on regional socio-economic developments in Slovakia from 2013 to 2020 and draw,espon,https://www.espon.eu/geography-new-employment-dynamics-slovakia
Download our TerritoriALL app on your mobile,2021-06-29,"The new TerritoriALL magazine is now online.
You can read it in our new web-reader: https://territoriall.espon.eu and:",espon,https://www.espon.eu/download-our-territoriall-app-your-mobile
Circular Economy and Territorial Consequences -the case of the cross-border Scandinavian area,2021-06-17,A new report of our Circular Economy and Territorial Consequences (CIRCTER) project was published today.,espon,https://www.espon.eu/news-events/news/latest-news/circular-economy-and-territorial-consequences-case-cross-border
"New TerritoriALL: Rural Areas, with an eye to the future",2021-06-15,The EU decision-makers created in a record time a recovery plan to combine the current and future budgetary resources. But the implementation will be challenging.,espon,https://www.espon.eu/territoriall-vol3
Towards effective local decision-making,2021-06-08,"ESPON launched a survey today to gather insights from cities, towns and rural areas about their digitalisation efforts.",espon,https://www.espon.eu/towards-effective-local-decision-making
Circular Economy and Territorial Consequences -the case of Luxembourg,2021-05-21,"We published today a new report of our Circular Economy and Territorial Consequences (CIRCTER) project. This report will focus on the Grand Duchy of Luxembourg, which, at the moment, is developing",espon,https://www.espon.eu/circular-economy-and-territorial-consequences-case-luxembourg
ESPON at the Directors-General Meeting on Territorial Cohesion,2021-05-19,"ESPON presented a new policy, brief drafted together with the Portuguese Presidency, today at the Directors-General Meeting on Territorial Cohesion that took place online.",espon,https://www.espon.eu/espon-directors-general-meeting-territorial-cohesion
Making Green Infrastructure Socially Inclusive: Principles and Challenges,2021-05-14,"""Although it is widely accepted that Green Infrastructure can deliver multiple ecosystem services, there is still uncertainty concerning how it can best be designed, implemented and maintaine",espon,https://www.espon.eu/making-green-infrastructure-socially-inclusive-principles-and-challenges
Estonia: Regional strategies for sustainable and inclusive territorial development,2021-05-11,"Today, we are publishing a spin-off report - the ReSSI-EE (Regional Strategies for Sustainable and Inclusive Territorial Development – Estonia) that provides evidence-based policy",espon,https://www.espon.eu/estonia-regional-strategies-sustainable-and-inclusive-territorial-development
Update on thePreliminary Market Consultation - “ESPON portal - interactive mapping and dashboards”,2021-04-16,"The ESPON EGTC has organized a  preliminary market consultation, from 16 December 2020 to 28 February 2021, with the objective to acquire information regarding potential solutions to be envisaged f",espon,https://www.espon.eu/market-consultation-portal
,2021-07-13,,eucommission,https://ec.europa.eu/commission/presscorner/https://ec.europa.eu/info/contact/press-services/press-contacts/press-contacts-spokespersons-service_en
Speech by President von der Leyen at the Rome W20 Summit,2021-07-13,,eucommission,https://ec.europa.eu/commission/presscorner/detail/en/speech_21_3684
Press remarks by Vice-President Šefčovič in Kyiv at the signing of the Partnership on Raw Materials,2021-07-13,,eucommission,https://ec.europa.eu/commission/presscorner/detail/en/speech_21_3683
NextGenerationEU: European Commission raises further €10 billion in a successful third bond to support Europe's recovery,2021-07-13,"The European Commission has today issued a further €10 billion to support Europe's recovery from the coronavirus crisis and its consequences, in a third NextGenerationEU bond since the start of the programme in mid-June.",eucommission,https://ec.europa.eu/commission/presscorner/detail/en/ip_21_3682
Political agreement on the Aarhus Regulation: Commission welcomes increased public scrutiny of EU acts related to the environment,2021-07-13,The Commission welcomes the provisional political agreement reached yesterday between the European Parliament and the EU Member States in the Council on amending the Aarhus Regulation that will allow for increased public scrutiny of EU acts affecting the environment.,eucommission,https://ec.europa.eu/commission/presscorner/detail/en/ip_21_3610
New EU guidance helps companies to combat forced labour in supply chains,2021-07-13,"The Commission and the European External Action Service (EEAS) have published today a Guidance on due diligence to help EU companies to address the risk of forced labour in their operations and supply chains, in line with international standards. ",eucommission,https://ec.europa.eu/commission/presscorner/detail/en/ip_21_3664
Recovery and Resilience Facility: Malta submits official recovery and resilience plan,2021-07-13,The Commission has today received an official recovery and resilience plan from Malta.,eucommission,https://ec.europa.eu/commission/presscorner/detail/en/ip_21_3407
EU and Ukraine kick-start strategic partnership on raw materials,2021-07-13,"Today, the EU and Ukraine have launched a strategic partnership on raw materials, with the aim of achieving a closer integration of raw materials and batteries value chains.",eucommission,https://ec.europa.eu/commission/presscorner/detail/en/ip_21_3633
Remarks by Commissioner Gentiloni at the Eurogroup press conference,2021-07-12,,eucommission,https://ec.europa.eu/commission/presscorner/detail/en/speech_21_3678
Humanitarian aid: EU mobilises €22 million to support most vulnerable in Iran and Pakistan,2021-07-12,Today the Commission has announced renewed support for those most in need in Iran and Pakistan with €22 million in humanitarian aid.,eucommission,https://ec.europa.eu/commission/presscorner/detail/en/ip_21_3630
Competition: Commission publishes findings of evaluation of Market Definition Notice,2021-07-12,The European Commission has published today a Staff Working Document summarising the findings of its evaluation of the Market Definition Notice used in EU competition law.,eucommission,https://ec.europa.eu/commission/presscorner/detail/en/ip_21_3585
Boosting the EU’s capacity to anticipate and respond to health crises,2021-07-13 12:21:00,"MEPs outline how the EU should strengthen crisis prevention, preparedness and response when addressing future serious cross-border health threats.",euparliament,https://www.europarl.europa.eu/news/it/press-room/20210707IPR07902/boosting-the-eu-s-capacity-to-anticipate-and-respond-to-health-crises
Conferenza di alto livello sullo stato globale dei diritti umani,2021-07-12 12:46:00,"Il 16 luglio, il Parlamento ospiterà per la prima volta la conferenza sullo stato globale dei diritti umani, per discutere la situazione dei diritti umani a livello internazionale.",euparliament,https://www.europarl.europa.eu/news/it/press-room/20210712IPR08208/conferenza-di-alto-livello-sullo-stato-globale-dei-diritti-umani
EU 2030 climate target: MEPs to quiz Commission VP Timmermans,2021-07-12 11:59:00,"Executive VP Timmermans will present the Commission’s “Fit for 55 in 2030” package and debate with Environment Committee MEPs, on the day of its adoption.",euparliament,https://www.europarl.europa.eu/news/it/press-room/20210707IPR07901/eu-2030-climate-target-meps-to-quiz-commission-vp-timmermans
"Human rights breaches in Hong Kong, Saudi Arabia and Iran",2021-07-08 16:52:00,"On Thursday, the European Parliament adopted three resolutions on the human rights situation in Hong Kong, Saudi Arabia and Iran.",euparliament,https://www.europarl.europa.eu/news/it/press-room/20210701IPR07521/human-rights-breaches-in-hong-kong-saudi-arabia-and-iran
Antartide: soluzione rapida per proteggere le aree marine,2021-07-08 16:49:00,I deputati vogliono che lo stallo nei negoziati internazionali per la creazione di due aree marine protette in Antartide finisca presto.,euparliament,https://www.europarl.europa.eu/news/it/press-room/20210701IPR07519/antartide-soluzione-rapida-per-proteggere-le-aree-marine
Turkey: MEPs strongly condemn repression of opposition,2021-07-08 16:49:00,"Deep concern expressed by MEPs over constant attacks and pressure on Turkish opposition parties, in a resolution adopted on Thursday.",euparliament,https://www.europarl.europa.eu/news/it/press-room/20210701IPR07520/turkey-meps-strongly-condemn-repression-of-opposition
Nicaragua: MEPs demand the repeal of punitive laws against the opposition,2021-07-08 16:45:00,MEPs condemn restrictive laws devised to criminalise political opponents in Nicaragua and call for all arbitrarily detained political prisoners to be immediately released.,euparliament,https://www.europarl.europa.eu/news/it/press-room/20210702IPR07623/nicaragua-meps-demand-the-repeal-of-punitive-laws-against-the-opposition
Legge ungherese anti-LGBTIQ: il Parlamento chiede reazione UE,2021-07-08 16:43:00,"Il Parlamento ""condanna con la massima fermezza"" la recente legislazione anti-LGBTIQ e denuncia lo smantellamento della democrazia e dello Stato di diritto in Ungheria.",euparliament,https://www.europarl.europa.eu/news/it/press-room/20210701IPR07502/legge-ungherese-anti-lgbtiq-il-parlamento-chiede-reazione-ue
EMA: rafforzare il mandato dell’Agenzia,2021-07-08 13:13:00,"Giovedì, il Parlamento ha adottato la sua posizione per i negoziati con il Consiglio sull'estensione del mandato dell'Agenzia europea per i medicinali (EMA).",euparliament,https://www.europarl.europa.eu/news/it/press-room/20210701IPR07513/ema-rafforzare-il-mandato-dell-agenzia
Diritti umani: i deputati vogliono che la corruzione sia inclusa nel regime di sanzioni dell'UE,2021-07-08 09:24:00,"Il Parlamento ha adottato giovedì una risoluzione che sostiene il regime UE di sanzioni globali per i diritti umani, chiedendo però l’inclusione della corruzione come reato punibile.",euparliament,https://www.europarl.europa.eu/news/it/press-room/20210701IPR07516/diritti-umani-includere-la-corruzione-nel-regime-di-sanzioni-dell-ue
Rule of Law conditionality: Parliament wants investigations launched immediately,2021-07-08 09:22:00,The budget conditionality regulation does not require any additional clarification and rule of law breaches must be addressed as soon as possible.,euparliament,https://www.europarl.europa.eu/news/it/press-room/20210701IPR07512/rule-of-law-conditionality-parliament-wants-investigations-launched-immediately
EP Today,2021-07-08 08:30:00,"Thursday, 8 July",euparliament,https://www.europarl.europa.eu/news/it/press-room/20210701IPR07508/ep-today
"High time for Council and Commission to protect Europeans and the EU, MEPs say",2021-07-07 13:43:00,A broad majority of MEPs demanded action from the Council and the Commission against the continuous deterioration of EU values in Hungary and Poland.,euparliament,https://www.europarl.europa.eu/news/it/press-room/20210702IPR07622/high-time-for-council-and-commission-to-protect-europeans-and-the-eu-meps-say
MEPs call for the protection of fundamental values in the EU and worldwide,2021-07-07 11:21:00,The threat to democracy and fundamental rights in several member states was the main issue discussed on Wednesday with Presidents Michel and von der Leyen.,euparliament,https://www.europarl.europa.eu/news/it/press-room/20210701IPR07511/meps-call-for-the-protection-of-fundamental-values-in-the-eu-and-worldwide
€30 miliardi per progetti infrastrutturali per collegare le regioni dell'UE,2021-07-07 09:20:00,"Mercoledì, il Parlamento ha approvato in via definitiva la seconda edizione del Meccanismo per collegare l'Europa con nuovi finanziamenti per trasporti, digitale ed energia per il 2021-2027.",euparliament,https://www.europarl.europa.eu/news/it/press-room/20210701IPR07504/EU30-miliardi-per-progetti-infrastrutturali-per-collegare-le-regioni-dell-ue
Recovery from COVID-19 – Driving Healthcare Resilience in the EU,2021-07-12,,euregha,"[[...], [...], [...], [...], [...], [...], [...], [...], [...], [...], [...], [...]]"
EUREGHA is looking for a new Communications and Project Officer,2021-06-30,,euregha,"[[...], [...], [...], [...], [...], [...], [...], [...], [...], [...], [...], [...]]"
