title,pub_date,snippet,source,link
La Segretaria generale partecipa alla cerimonia di apertura del Forum sull'uguaglianza generazionale a Parigi,2021-06-30,"La Segretaria generale Marija Pejčinović Burić ha sottolineato l'importanza della Convenzione sulla prevenzione e la lotta alla violenza contro le donne e la violenza domestica, nota anche come Convenzione di Istanbul, alla cerimonia di apertura del Forum sull'uguaglianza generazionale a Parigi....",consigliodeuropait,https://www.coe.int/it/web/portal/-/secretary-general-participates-in-opening-ceremony-of-generation-equality-forum-in-paris
Rapporto della Convenzione di Varsavia: inversione dell’onere della prova per autorizzare la confisca nei reati gravi,2021-06-30,Il Comitato della Convenzione del Consiglio d’Europa contro il riciclaggio di capitali e il finanziamento del terrorismo (Convenzione di Varsavia) chiede agli Stati contraenti di applicare in modo efficace l’inversione dell’onere della prova in relazione all’origine legittima di presunti proventi...,consigliodeuropait,https://www.coe.int/it/web/portal/-/warsaw-convention-report-burden-of-proof-should-be-reversed-to-allow-confiscations-in-serious-offences
Press statement following the 4th meeting of the Stabilisation and Association Council between the EU and Bosnia and Herzegovina,2021-07-13 19:30:00,The Stabilisation and Association Council between the European Union and Bosnia and Herzegovina held its fourth meeting on 13 July 2021 in Brussels.,consiglioeuropeo,https://www.consilium.europa.eu/it/press/press-releases/2021/07/13/4th-meeting-of-the-stabilisation-and-association-council-between-the-eu-and-bosnia-and-herzegovina/
Declaration by the High Representative on behalf of the European Union on the alignment of certain third countries with the Council Decision (CFSP) 2021/1031 concerning restrictive measures in view of the situation in Belarus,2021-07-13 19:30:00,Declaration by the High Representative on behalf of the European Union on the alignment of certain third countries with the Council Decision (CFSP) 2021/1031 of 24 June 2021 amending Council Decision 2012/642/CFSP concerning restrictive measures in view of the situation in Belarus.,consiglioeuropeo,https://www.consilium.europa.eu/it/press/press-releases/2021/07/13/declaration-by-the-high-representative-on-behalf-of-the-european-union-on-the-alignment-of-certain-countries-concerning-restrictive-measures-in-view-of-the-situation-in-belarus/
Conclusioni del Consiglio sugli esami approfonditi 2021 nell'ambito delle procedure per gli squilibri macroeconomici,2021-07-13 19:30:00,Il 13 luglio 2021 il Consiglio ha approvato conclusioni sugli esami approfonditi 2021 nell'ambito delle procedure per gli squilibri macroeconomici.,consiglioeuropeo,https://www.consilium.europa.eu/it/press/press-releases/2021/07/13/council-conclusions-on-the-2021-in-depth-reviews-under-the-macroeconomic-imbalance-procedure/
Via libera del Consiglio ai primi esborsi per la ripresa,2021-07-13 19:30:00,Il Consiglio ha adottato oggi il primo pacchetto di decisioni di esecuzione del Consiglio sull'approvazione dei piani nazionali per la ripresa e la resilienza.,consiglioeuropeo,https://www.consilium.europa.eu/it/press/press-releases/2021/07/13/council-gives-green-light-to-first-recovery-disbursements/
"Il Consiglio adotta un'esenzione temporanea dall'IVA per ""acquisto e donazione""",2021-07-13 19:30:00,Oggi il Consiglio ha adottato una modifica della direttiva IVA che introduce un'esenzione temporanea dall'IVA applicabile alle importazioni e a talune cessioni e prestazioni in risposta alla pandemia di COVID-19.,consiglioeuropeo,https://www.consilium.europa.eu/it/press/press-releases/2021/07/13/council-adopts-a-temporary-buy-and-donate-vat-exemption/
Impresa comune per il calcolo ad alte prestazioni europeo: il Consiglio adotta il regolamento,2021-07-13 19:30:00,Regolamento del Consiglio che apre la strada allo sviluppo della prossima generazione di supercomputer in Europa.,consiglioeuropeo,https://www.consilium.europa.eu/it/press/press-releases/2021/07/13/european-high-performance-computing-joint-undertaking-council-adopts-regulation/
Accordo provvisorio del Consiglio e del Parlamento sull'accesso alla giustizia in materia ambientale,2021-07-12 20:40:00,"Il Consiglio e il Parlamento europeo hanno raggiunto oggi un accordo politico provvisorio su una proposta di revisione del regolamento Aarhus, che mira a garantire l'accesso alle informazioni, la partecipazione del pubblico ai processi decisionali e l'accesso alla giustizia in materia ambientale.",consiglioeuropeo,https://www.consilium.europa.eu/it/press/press-releases/2021/07/12/council-and-parliament-reach-provisional-deal-on-access-to-justice-in-environmental-matters/
Remarks by Paschal Donohoe following the Eurogroup meeting of 12 July 2021,2021-07-12 20:40:00,"Remarks by Paschal Donohoe following the Eurogroup meeting of 12 July 2021 on the exchange of views with US Treasury Secretary Janet Yellen, fiscal stance of the euro area and the digital future of the euro.",consiglioeuropeo,https://www.consilium.europa.eu/it/press/press-releases/2021/07/12/remarks-by-paschal-donohoe-following-the-eurogroup-meeting-of-12-july-2021/
Western Balkans and Turkey: Joint conclusions of the economic and financial dialogue of 12 July 2021,2021-07-12 20:40:00,"Representatives of the EU Member States, the Western Balkans and Turkey, the European Commission and the European Central Bank, as well as representatives of the central banks of the Western Balkans and Turkey  met for their annual economic policy dialogue . The dialogue aims at preparing the Western Balkans and Turkey for their future participation in the European Semester.",consiglioeuropeo,https://www.consilium.europa.eu/it/press/press-releases/2021/07/12/western-balkans-and-turkey-joint-conclusions-of-the-economic-and-financial-dialogue-of-12-july-2021/
Priorità dell'UE per la 76ª Assemblea generale delle Nazioni Unite,2021-07-12 20:40:00,Il Consiglio ha approvato le conclusioni in cui definisce le priorità dell'UE nel contesto delle Nazioni Unite durante la 76ª sessione dell'Assemblea generale delle Nazioni Unite (settembre 2021 – settembre 2022).,consiglioeuropeo,https://www.consilium.europa.eu/it/press/press-releases/2021/07/12/eu-priorities-at-the-76th-united-nations-general-assembly/
Un'Europa connessa a livello globale: il Consiglio approva conclusioni,2021-07-12 20:40:00,"Il Consiglio ha approvato le conclusioni su un'Europa connessa a livello globale, in cui si sottolinea l'importanza della connettività per la promozione degli interessi geostrategici e dei valori dell'UE a livello mondiale.",consiglioeuropeo,https://www.consilium.europa.eu/it/press/press-releases/2021/07/12/a-globally-connected-europe-council-approves-conclusions/
Russia: l'UE proroga di sei mesi le sanzioni economiche in risposta alla destabilizzazione dell'Ucraina,2021-07-12 20:40:00,"Il Consiglio ha prorogato di altri sei mesi, fino al 31 gennaio 2022, le sanzioni riguardanti settori economici specifici della Federazione russa.",consiglioeuropeo,https://www.consilium.europa.eu/it/press/press-releases/2021/07/12/russia-eu-prolongs-economic-sanctions-over-the-destabilisation-of-ukraine-by-six-months/
Mozambico: l'UE istituisce una missione militare di formazione per contribuire ad affrontare la crisi a Cabo Delgado,2021-07-12 20:40:00,Il Consiglio ha deciso di istituire una missione militare di formazione dell'UE in Mozambico per sostenere le forze armate locali nella protezione della popolazione civile e nel ripristino della sicurezza a Cabo Delgado.,consiglioeuropeo,https://www.consilium.europa.eu/it/press/press-releases/2021/07/12/mozambique-eu-launches-a-military-training-mission-to-help-address-the-crisis-in-cabo-delgado/
Video message by President Charles Michel on the occasion of Srebrenica Memorial Day,2021-07-11 09:00:00,Video message by President Charles Michel on the occasion of Srebrenica Memorial Day,consiglioeuropeo,https://www.consilium.europa.eu/it/press/press-releases/2021/07/11/video-message-by-president-michel-on-the-occasion-of-srebrenica-memorial-day/
Programma settimanale del presidente Charles Michel,2021-07-09 18:00:00,"Programma settimanale del presidente Charles Michel, 12 - 18 luglio 2021",consiglioeuropeo,https://www.consilium.europa.eu/it/press/press-releases/2021/07/09/weekly-schedule-of-president-charles-michel/
Prossimamente: 12 - 25 luglio 2021,2021-07-09 18:00:00,Panoramica dei principali temi che saranno discussi nelle sessioni del Consiglio dell'UE delle prossime due settimane e prossimi eventi per i media.,consiglioeuropeo,https://www.consilium.europa.eu/it/press/press-releases/2021/07/09/forward-look/
Presentation of letters of credentials to the President of the European Council Charles Michel,2021-07-08 17:50:00,President Michel received the letters of credentials from six new ambassadors to the European Union.,consiglioeuropeo,https://www.consilium.europa.eu/it/press/press-releases/2021/07/08/presentation-of-letters-of-credentials-to-the-president-of-the-european-council-charles-michel/
Corte di giustizia dell'UE: nomina di due giudici e di due avvocati generali della Corte di giustizia,2021-07-07 13:25:00,Corte di giustizia dell'UE: nomina di due giudici e di due avvocati generali della Corte di giustizia.,consiglioeuropeo,https://www.consilium.europa.eu/it/press/press-releases/2021/07/07/eu-court-of-justice-appointment-of-two-judges-and-two-advocates-generals-of-the-court-of-justice/
Relazione del presidente Charles Michel alla seduta plenaria del Parlamento europeo,2021-07-07 13:25:00,Relazione del presidente Charles Michel alla seduta plenaria del Parlamento europeo sul Consiglio europeo del 24 e 25 giugno 2021.,consiglioeuropeo,https://www.consilium.europa.eu/it/press/press-releases/2021/07/07/report-by-president-charles-michel-to-the-european-parliament-plenary-session/
Dichiarazione dell'alto rappresentante a nome dell'Unione europea sull'adesione di taluni paesi terzi alla decisione (PESC) 2021/1002 del Consiglio relativa a misure restrittive in considerazione della situazione in Bielorussia,2021-07-06 11:45:00,"Dichiarazione dell'alto rappresentante a nome dell'Unione europea sull'adesione di taluni paesi terzi alla decisione (PESC) 2021/1002 del Consiglio, del 21 giugno 2021, che attua la decisione 2012/642/PESC relativa a misure restrittive in considerazione della situazione in Bielorussia.",consiglioeuropeo,https://www.consilium.europa.eu/it/press/press-releases/2021/07/06/declaration-by-the-high-representative-on-behalf-of-the-eu-on-the-alignment-of-certain-countries-concerning-restrictive-measures-in-view-of-the-situation-in-belarus/
CPMR Regions reflect on a green recovery for the Future of Europe,2021-06-30,"Members of the CPMR Political Bureau gathered last 24 June in a hybrid meeting organised from Amsterdam, Noord-Holland region, under the auspices of CPMR President Cees Loggen. The agenda for the meeting included two focus [...]",cpmr,https://cpmr.org/uncategorized/cpmr-regions-reflect-on-a-green-recovery-for-the-future-of-europe/29331/
BEST MED and SMARTMED midterm’s update: setting the basis for transferring and capitalising results,2021-06-29,"For the two PANORAMED’s Strategic Projects on Coastal and Maritime Tourism, the last six months have represented the transition from the end of the studying phase – with a focus on the organisation of Policy [...]",cpmr,https://cpmr.org/projects/best-med-and-smartmed-midterms-update-moving-from-studying-to-testing-phases-and-setting-the-basis-for-transferring-and-capitalising-the-preliminary-results/29317/
The CPMR Intermediterranean Commission (IMC) is looking for two INTERREG Volunteers to join the team!,2021-06-25,The CPMR Intermediterranean Commission (IMC) is looking for two INTERREG Volunteers to join the team in the offices of Marseille (Blue Economy and Sustainable Tourism) and Barcelona (Sustainable Tourism). Applicants may apply to both [...],cpmr,https://cpmr.org/job-opportunities/the-cpmr-intermediterranean-commission-imc-is-looking-for-two-interreg-volunteers-to-join-the-team/29271/
Regions exceed expectations to deliver EU climate neutrality target,2021-06-24,"A survey conducted by the CPMR shows that 37% of CPMR member regions have a higher ambition than the 2050 European Union climate neutrality target, which is matched by actions already being implemented on the [...]",cpmr,https://cpmr.org/energy-climate/regions-exceed-expectations-to-deliver-eu-climate-neutrality-target/29218/
HERIT-DATA mid-term event: how to better manage tourism flows impact on cultural and natural heritage through technologies and big data,2021-06-23,"The HERIT-DATA project mid-term conference took place online last 9 and 10 June 2021. The two-day conference presented the results obtained by the HERIT-DATA project during the first two years of implementation. HERIT-DATA, in which [...]",cpmr,https://cpmr.org/maritime/herit-data-mid-term-event-how-to-better-manage-tourism-flows-impact-on-cultural-and-natural-heritage-through-technologies-and-big-data/29222/
CPMR presents in-depth analysis on the National Recovery and Resilience Plans,2021-06-17,"The CPMR has published today an in-depth analysis that looks into the National Recovery and Resilience Plans (NRRPs) presented by EU Member States, and the extent to which the territorial dimension is addressed. The publication [...]",cpmr,https://cpmr.org/cohesion/cpmr-presents-in-depth-analysis-on-the-national-recovery-and-resilience-plans/29175/
The CPMR Atlantic Arc Commission calls Atlantic Member States to develop an Atlantic Macro-Region,2021-10-06,"On the 9 of June, Members of the CPMR Atlantic Arc Commission (AAC) met with Secretaries of States of Portugal and Spain, as well as with MEP Younous Omarjee, Chair of the REGI committee, and [...]",cpmr,https://cpmr.org/maritime/the-cpmr-atlantic-arc-commission-calls-atlantic-member-states-to-develop-an-atlantic-macro-region/29123/
CPMR urges Commissioner Gentiloni to ensure regional involvement in the delivery of the National Recovery and Resilience Plans,2021-05-28,"As the European Commission is about to assess the National Recovery and Resilience Plans (NRRPs) submitted by Member States, a delegation of Presidents of Regions of the CPMR have shared their views with Commissioner for [...]",cpmr,https://cpmr.org/cohesion/cpmr-urges-commissioner-gentiloni-to-ensure-regional-involvement-in-the-delivery-of-the-national-recovery-and-resilience-plans/28979/
Promoting Sustainable Coastal Tourism for a Smart and Resilient Recovery,2021-05-28,"The CPMR, together with its Geographical Commissions, held a successful workshop during the European Maritime Day 2021 (May 19-20) bringing together various perspectives around the theme “Sustainable Coastal Tourism: Key Actions Towards a Smart and [...]",cpmr,https://cpmr.org/maritime/promoting-sustainable-coastal-tourism-for-a-smart-and-resilient-recovery/28983/
The CPMR calls on the “Fit for 55” package to have a territorial approach empowering regions,2021-05-20,"The CPMR and 49 organisations gathered together to call upon EU leaders to step up the EU’s climate ambition, while supporting a green, territorially balanced, and socially fair transition in all regions. Ahead of the [...]",cpmr,https://cpmr.org/energy-climate/the-cpmr-calls-on-the-fit-for-55-package-to-have-a-territorial-approach-empowering-regions/28905/
iqCampusFP#2021: VET teachers and pedagogies at the heart of the discussion!,2021-09-07,"From 2 to 7 July 2021, the Regional Ministry of Education of the Government of Catalonia organised the International VET Campus iqcAMPUSfp#2021, in... ",earlall,https://www.earlall.eu/iqcampusfp2021/
Teaching methodologies for VET lessons: The CLIL approach,2021-06-07,The Catalan Ministry of Education and EARLALL hosted the “Teaching methodologies for VET lessons: the CLIL approach” on 2 June 2021. The...,earlall,https://www.earlall.eu/teaching-methodologies-for-vet-lessons-the-clil-approach/
Varaždin County spreads youth entrepreneurship spirit,2021-06-29,"In the context of the YESpecialists project, co-funded by the Erasmus+ programme of the European Union, Varaždin County is configuring local... ",earlall,https://www.earlall.eu/varazdin-county-spreads-youth-entrepreneurship-spirit/
First #S4Stride workshop was hosted by Tuscany online,2021-06-21,The first best practice exchange workshop under the #S4Stride project’s umbrella (Stride for stride for skills adaptation/anticipation in...,earlall,https://www.earlall.eu/first-s4stride-workshop-was-hosted-by-tuscany-online/
"Multiple perspectives, a single goal: the BRIDGE+ conference brought skills to the centre of the debate",2021-10-06,The BRIDGE+ conference “Skills for the future: regional initiatives now!” gathered more than 50 experts from the European level and from European...,earlall,https://www.earlall.eu/multiple-perspectives-a-single-goal-the-bridge-conference-brought-skills-to-the-centre-of-the-debate/
High-level conference on the role of Regions and Cities in delivering high quality apprenticeships for all,2021-08-06,"On 3 and 4 June 2021, a two-day high-level conference on the role of Regions and Cities in delivering high quality apprenticeships for all was held... ",earlall,https://www.earlall.eu/high-level-conference-on-the-role-of-regions-and-cities-in-delivering-high-quality-apprenticeships-for-all/
EARLALL hosted a training workshop on the new Erasmus+ programme,2021-04-05,"On 28 April 2021, EARLALL organised a training course on the new Erasmus+ programme for its member regions’ staff dealing with vocational education... ",earlall,https://www.earlall.eu/earlall-hosted-a-training-workshop-on-the-new-erasmus-programme/
First EXAM 4.0 reports now available,2021-04-19,"The EXAM 4.0 partnership has published a set of publications dealing with the ""Learning Dialogues"" and ""EXAM 4.0 labs"" project strands. The documents... ",earlall,https://www.earlall.eu/first-exam-4-0-reports-now-available/
Cedefop hosted conference on skills intelligence,2021-04-15,"On 13 April 2021, Cedefop (European Centre for the Development of Vocational Training) held an online high-level conference on Labour Market and... ",earlall,https://www.earlall.eu/cedefop-hosted-conference-on-skills-intelligence/
Virtual trip to Asturias: second YESpecialists transnational meeting,2021-04-13,"YESpecialists project partners met online for their second official transnational meeting, hosted by the Principality of Asturias, on 7 and 8 April... ",earlall,https://www.earlall.eu/virtual-trip-to-asturias-second-yespecialists-transnational-meeting/
Fostering digital mobility in VET: DAMAS project kicked off,2021-06-04,"The DAMAS (Digital Apprentices Mobility in the Automotive Sector) project, co-funded by the Erasmus+ program (KA2) was launched through an online... ",earlall,https://www.earlall.eu/fostering-digital-mobility-in-vet-damas-project-kicked-off/
Rhineland-Palatinate celebrates 25 years of its Further-Education-Act,2021-03-24,The Further Education Act Rhineland-Palatinate came into force 25 years ago. Since then it has formed the basis for a wide range of future-oriented...,earlall,https://www.earlall.eu/rhineland-palatinate-celebrates-25-years-of-its-further-education-act/
Sharp decrease in CO2 emissions of new cars in 2020,2021-06-29,"The European Environment Agency (EEA) has published its provisional data about the emissions of newly registered passenger cars and vans in Europe in 2020. For cars, the data show a 12 % decrease in average carbon dioxide (CO2) emissions, compared with 2019. Average van emissions also decreased slightly, by about 1.5 %. ",eea,https://www.eea.europa.eu/highlights/sharp-decrease-in-emissions-of
"COVID-19 in Europe: increased pollution from masks, gloves and other single-use plastics",2021-06-22,"The coronavirus pandemic has challenged European societies in many ways. The European Environment Agency’s (EEA) briefing, published today, analyses the pandemic’s effect on the use of certain single-use plastics products, which cause greenhouse gas and other emissions and can end up littering the environment. It also brings useful lessons to improve our response to future disruptive events.",eea,https://www.eea.europa.eu/highlights/covid19-in-europe-increased-pollution
New European city air quality viewer allows you to check long term air pollution levels where you live,2021-06-17,"Air pollution is a serious problem in many European cities, posing a real risk to health. Today, the European Environment Agency (EEA) launched the European city air quality viewer. You can check how the air quality has been over the past two years in the city where you live and compare it with other cities across Europe.",eea,https://www.eea.europa.eu/highlights/new-european-city-air-quality
"Cities play pivotal roles in shifting to green, sustainable future",2021-06-14,"European cities have the potential to lead the way towards green, sustainable future, according to two assessments on urban environmental change, published by the European Environment Agency (EEA) today.",eea,https://www.eea.europa.eu/highlights/cities-play-pivotal-roles-in
Zero Pollution: Vast majority of Europe’s bathing waters meet the highest quality standards,2021-06-01,"The annual Bathing Water report published today shows that in 2020, almost 83 % of Europe’s bathing water sites met the European Union’s most stringent ‘excellent’ water quality standards. The latest assessment (European bathing water quality in 2020), put together by the European Environment Agency (EEA) in cooperation with the European Commission, is based on the 2020 monitoring of 22 276 bathing sites across Europe. These cover the EU Member States, Albania and Switzerland throughout 2020. ",eea,https://www.eea.europa.eu/highlights/zero-pollution-vast-majority-of
"Average car emissions kept increasing in 2019, final data show ",2021-06-01,"Average emissions from new passenger cars in Europe increased for the third consecutive year in 2019, reaching 122.3 grams of carbon dioxide per kilometre (g CO2/km), according to the European Environment Agency’s (EEA) final data. Data about newly registered vans show a stable trend. New EEA data set baseline for emission reductions in heavy-duty vehicles. ",eea,https://www.eea.europa.eu/highlights/average-car-emissions-kept-increasing
"Major drop in EU's greenhouse gas emissions in 2019, official data confirms",2021-05-31,"Greenhouse gas emissions in the European Union (EU) decreased by almost 4 % in 2019, according to latest official data, published today by the European Environment Agency (EEA). These data confirm the EEA’s preliminary estimates, published in October 2020. The large decline in emissions, achieved before the COVID-19 crisis, was mainly due to reduced coal use for power generation.",eea,https://www.eea.europa.eu/highlights/major-drop-in-eus-greenhouse
EEA's latest annual environmental performance assessment shows lower impacts on environment due to the pandemic,2021-05-27,The European Environment Agency’s (EEA) latest environmental performance data shows that the Agency’s work and operations in 2020 led to considerably lower impacts on the environment due mostly to restrictions imposed by the COVID-19 pandemic.,eea,https://www.eea.europa.eu/highlights/eeas-latest-annual-environmental-performance
Executive Director welcomes Slovak President Čaputová to EEA,2021-05-11,"European efforts to tackle climate change, air pollution and achieving carbon neutrality were the main issues discussed during a visit of President Zuzana Čaputová of Slovakia to the European Environment Agency (EEA) on Tuesday (11 May 2021). ",eea,https://www.eea.europa.eu/highlights/executive-director-welcomes-slovak-president
Independent national advisory bodies can reinforce the role of science in climate policy,2021-05-11,"Efforts in tackling climate change at national level across Europe can be made more effective by robust governance frameworks as well as well-functioning, well-resourced advisory bodies. A European Environment Agency (EEA) briefing published today analyses the institutional settings for climate policy making at the national level in Europe, the role played by advisory bodies in these settings and their influence on policy decisions.",eea,https://www.eea.europa.eu/highlights/independent-national-advisory-bodies
Bill Gates and the EIB: A new model to accelerate green innovation,2021-07-13,"13 July 2021 - Most green technologies are still more expensive than the systems they’re trying to replace, and they don’t do a better job providing energy. In many cases, they do a poorer job. Clean jet fuel, for example, provides less energy per gallon than the conventional stuff, and it costs a lot more.",eib,https://www.eib.org/en/press/news/bill-gates-and-the-eib-a-new-model-to-accelerate-green-innovation
Italy: Cassa Depositi e Prestiti and the EIB team up to support access to credit for Italian businesses,2021-07-13,"13 July 2021 - Cassa Depositi e Prestiti (CDP) and the European Investment Bank (EIB) today signed a guarantee agreement, under the framework of the European Guarantee Fund (EGF), to support access to credit for Italian businesses that, despite having solid long-term prospects, are experiencing difficulty as a result of the current macroeconomic situation.",eib,https://www.eib.org/en/press/all/2021-263-cassa-depositi-e-prestiti-and-the-eib-team-up-to-support-access-to-credit-for-italian-businesses
